{
  "schema_version": "carnet.brand_inventory/1",
  "brand": "Toyota",
  "read_only": true,
  "source": "assets/car_catalog.json (canonical model list) + assets/car_spec_dataset.json (legacy rows resolved by model_boundaries.py). Nothing under assets/ or lib/ is written.",
  "rules": "rules/brand_enrichment_rules.json -> inventory",
  "totals": {
    "models": 86,
    "models_with_zero_legacy_rows": 26,
    "models_sparse_or_incomplete": 65,
    "models_with_enrichment_evidence": 22,
    "legacy_spec_rows": 2000,
    "collision_risk": {
      "HIGH": 4,
      "LOW": 61,
      "MEDIUM": 21
    }
  },
  "models": [
    {
      "model": "4Runner",
      "legacy_spec_rows": 50,
      "legacy_dataset_model_names": 39,
      "catalog_trim_count": 9,
      "catalog_trims": [
        "Limited",
        "Nightshade",
        "Platinum",
        "SR5",
        "SR5 Premium",
        "Trail Special Edition",
        "TRD Off-Road",
        "TRD Pro",
        "TRD Sport"
      ],
      "newest_legacy_model_year": 2024,
      "oldest_legacy_model_year": 1984,
      "sparse_or_incomplete": false,
      "sparse_flags": [],
      "collision_risk": "LOW",
      "collision_detail": {
        "longer_siblings": [],
        "shorter_parents": [],
        "must_remain_distinct_with": [],
        "legacy_loose_rule_rows": 51,
        "rows_borrowed_from_siblings_by_loose_rule": 0,
        "rows_quarantined_ambiguous_qualifier": 1
      },
      "has_enrichment_evidence": false,
      "enrichment_evidence": null,
      "current_known_dimensions": {
        "trims": [
          "Limited",
          "Nightshade",
          "Platinum",
          "SR5",
          "SR5 Premium",
          "Trail Special Edition",
          "TRD Off-Road",
          "TRD Pro",
          "TRD Sport"
        ],
        "engines": [
          "2.4L",
          "2.7L",
          "3.0L",
          "3.4L",
          "4.0L",
          "4.7L"
        ],
        "cylinders": [
          4,
          6,
          8
        ],
        "fuel": [
          "Diesel",
          "Petrol"
        ],
        "transmission": [
          "Automatic",
          "Manual"
        ],
        "drivetrain": [
          "AWD",
          "RWD"
        ],
        "seating": [
          5,
          7
        ],
        "body_type": [
          "SUV"
        ]
      }
    },
    {
      "model": "Alphard",
      "legacy_spec_rows": 19,
      "legacy_dataset_model_names": 18,
      "catalog_trim_count": 0,
      "catalog_trims": [],
      "newest_legacy_model_year": 2023,
      "oldest_legacy_model_year": 2002,
      "sparse_or_incomplete": true,
      "sparse_flags": [
        "few_trims"
      ],
      "collision_risk": "LOW",
      "collision_detail": {
        "longer_siblings": [],
        "shorter_parents": [],
        "must_remain_distinct_with": [],
        "legacy_loose_rule_rows": 19,
        "rows_borrowed_from_siblings_by_loose_rule": 0,
        "rows_quarantined_ambiguous_qualifier": 0
      },
      "has_enrichment_evidence": false,
      "enrichment_evidence": null,
      "current_known_dimensions": {
        "trims": [],
        "engines": [
          "2.4L",
          "2.5L",
          "3.0L",
          "3.5L"
        ],
        "cylinders": [
          4,
          6
        ],
        "fuel": [
          "Petrol"
        ],
        "transmission": [
          "Automatic"
        ],
        "drivetrain": [
          "AWD",
          "FWD"
        ],
        "seating": [
          7
        ],
        "body_type": [
          "Minivan"
        ]
      }
    },
    {
      "model": "Aristo",
      "legacy_spec_rows": 3,
      "legacy_dataset_model_names": 3,
      "catalog_trim_count": 0,
      "catalog_trims": [],
      "newest_legacy_model_year": 2005,
      "oldest_legacy_model_year": 1991,
      "sparse_or_incomplete": true,
      "sparse_flags": [
        "few_rows",
        "no_recent_years",
        "few_trims"
      ],
      "collision_risk": "LOW",
      "collision_detail": {
        "longer_siblings": [],
        "shorter_parents": [],
        "must_remain_distinct_with": [],
        "legacy_loose_rule_rows": 3,
        "rows_borrowed_from_siblings_by_loose_rule": 0,
        "rows_quarantined_ambiguous_qualifier": 0
      },
      "has_enrichment_evidence": true,
      "enrichment_evidence": {
        "evidence_file": "evidence/toyota/aristo.json",
        "record_count": 11,
        "source_count": 3,
        "researched_at": "2026-10-04",
        "pilot_evidence": false
      },
      "current_known_dimensions": {
        "trims": [],
        "engines": [
          "3.0L"
        ],
        "cylinders": [
          6
        ],
        "fuel": [
          "Petrol"
        ],
        "transmission": [
          "Automatic"
        ],
        "drivetrain": [
          "RWD"
        ],
        "seating": [
          5
        ],
        "body_type": [
          "Sedan"
        ]
      }
    },
    {
      "model": "Aurion",
      "legacy_spec_rows": 4,
      "legacy_dataset_model_names": 2,
      "catalog_trim_count": 0,
      "catalog_trims": [],
      "newest_legacy_model_year": 2017,
      "oldest_legacy_model_year": 2006,
      "sparse_or_incomplete": true,
      "sparse_flags": [
        "few_rows",
        "no_recent_years",
        "few_trims"
      ],
      "collision_risk": "LOW",
      "collision_detail": {
        "longer_siblings": [],
        "shorter_parents": [],
        "must_remain_distinct_with": [],
        "legacy_loose_rule_rows": 4,
        "rows_borrowed_from_siblings_by_loose_rule": 0,
        "rows_quarantined_ambiguous_qualifier": 0
      },
      "has_enrichment_evidence": true,
      "enrichment_evidence": {
        "evidence_file": "evidence/toyota/aurion.json",
        "record_count": 16,
        "source_count": 4,
        "researched_at": "2026-10-04",
        "pilot_evidence": false
      },
      "current_known_dimensions": {
        "trims": [],
        "engines": [
          "3.5L"
        ],
        "cylinders": [
          6
        ],
        "fuel": [
          "Petrol"
        ],
        "transmission": [
          "Automatic"
        ],
        "drivetrain": [
          "FWD"
        ],
        "seating": [
          5
        ],
        "body_type": [
          "Sedan"
        ]
      }
    },
    {
      "model": "Auris",
      "legacy_spec_rows": 44,
      "legacy_dataset_model_names": 25,
      "catalog_trim_count": 4,
      "catalog_trims": [
        "Design",
        "Excel",
        "Icon",
        "Special Edition"
      ],
      "newest_legacy_model_year": 2018,
      "oldest_legacy_model_year": 2006,
      "sparse_or_incomplete": true,
      "sparse_flags": [
        "no_recent_years"
      ],
      "collision_risk": "LOW",
      "collision_detail": {
        "longer_siblings": [],
        "shorter_parents": [],
        "must_remain_distinct_with": [],
        "legacy_loose_rule_rows": 44,
        "rows_borrowed_from_siblings_by_loose_rule": 0,
        "rows_quarantined_ambiguous_qualifier": 0
      },
      "has_enrichment_evidence": false,
      "enrichment_evidence": null,
      "current_known_dimensions": {
        "trims": [
          "Design",
          "Excel",
          "Icon",
          "Special Edition"
        ],
        "engines": [
          "1.2L",
          "1.3L",
          "1.4L",
          "1.6L",
          "1.8L",
          "2.0L",
          "2.2L"
        ],
        "cylinders": [
          4
        ],
        "fuel": [
          "Diesel",
          "Petrol"
        ],
        "transmission": [
          "Automatic",
          "Manual"
        ],
        "drivetrain": [
          "FWD"
        ],
        "seating": [
          5
        ],
        "body_type": [
          "Hatchback",
          "Wagon"
        ]
      }
    },
    {
      "model": "Avalon",
      "legacy_spec_rows": 13,
      "legacy_dataset_model_names": 8,
      "catalog_trim_count": 7,
      "catalog_trims": [
        "Limited",
        "Nightshade",
        "Platinum",
        "Touring",
        "TRD",
        "XLE",
        "XSE"
      ],
      "newest_legacy_model_year": 2022,
      "oldest_legacy_model_year": 1994,
      "sparse_or_incomplete": false,
      "sparse_flags": [],
      "collision_risk": "LOW",
      "collision_detail": {
        "longer_siblings": [],
        "shorter_parents": [],
        "must_remain_distinct_with": [],
        "legacy_loose_rule_rows": 13,
        "rows_borrowed_from_siblings_by_loose_rule": 0,
        "rows_quarantined_ambiguous_qualifier": 0
      },
      "has_enrichment_evidence": false,
      "enrichment_evidence": null,
      "current_known_dimensions": {
        "trims": [
          "Limited",
          "Nightshade",
          "Platinum",
          "Touring",
          "TRD",
          "XLE",
          "XSE"
        ],
        "engines": [
          "2.5L",
          "3.0L",
          "3.5L"
        ],
        "cylinders": [
          4,
          6
        ],
        "fuel": [
          "Petrol"
        ],
        "transmission": [
          "Automatic"
        ],
        "drivetrain": [
          "FWD"
        ],
        "seating": [
          5
        ],
        "body_type": [
          "Sedan"
        ]
      }
    },
    {
      "model": "Avanza",
      "legacy_spec_rows": 10,
      "legacy_dataset_model_names": 10,
      "catalog_trim_count": 0,
      "catalog_trims": [],
      "newest_legacy_model_year": 2018,
      "oldest_legacy_model_year": 2003,
      "sparse_or_incomplete": true,
      "sparse_flags": [
        "no_recent_years",
        "few_trims"
      ],
      "collision_risk": "LOW",
      "collision_detail": {
        "longer_siblings": [],
        "shorter_parents": [],
        "must_remain_distinct_with": [],
        "legacy_loose_rule_rows": 10,
        "rows_borrowed_from_siblings_by_loose_rule": 0,
        "rows_quarantined_ambiguous_qualifier": 0
      },
      "has_enrichment_evidence": false,
      "enrichment_evidence": null,